{"axis_count":3,"checks":{"below_initial":true,"edge_constraints_satisfied":true,"fixed_point":true,"verdicts_unchanged":true},"edge_count":3,"generator_sha256":"2695b37b119a7ed5c4be71d2734a04f1e4896c73e422debb7e0a19b1295e0fa1","input_sha256":"fd9b1a65acd727f7a168529ca6f485445e74fd44b4b0f068c165ccc66820c372","iterations":4,"node_count":3,"result":{"BSC-F15-DECISION":{"applicable_axes":["FORMAL","IDENTITY","REVIEW"],"readiness":{"FORMAL":"kernel-checked","IDENTITY":"claim-bound","REVIEW":"external"},"verdict":"open"},"BSC-F15-MODEL":{"applicable_axes":["FORMAL","IDENTITY","REVIEW"],"readiness":{"FORMAL":"kernel-checked","IDENTITY":"claim-bound","REVIEW":"external"},"verdict":"true"},"BSC-F15-SOURCE":{"applicable_axes":["IDENTITY","REVIEW"],"readiness":{"IDENTITY":"environment-bound","REVIEW":"external"},"verdict":"true"}},"schema":"bsc.claim-readiness-receipt.v1","status":"PASS"}
